{
  "current_strategy_id": "strategy1",
  "current_stage": "STAGE_2",
  "allowed_active_role": "MID_BACKEND_ENGINEER",
  "blocked_reason": "Stage 2 implementation is partially complete: Strategy1 now has VWAP-gated runtime/replay logic, minute-first daily validation replay with per-day VWAP/source diagnostics, validation-page non-blank chart/error states for degraded data, replay candidate-signal visibility when VWAP is unavailable, session-scoped VWAP handling that no longer reuses stale prior-day VWAP, mismatch detection APIs, validation-page VWAP/mismatch/manual-correction visibility, a read-only main-dashboard operator cockpit with live 1-minute candles/VWAP/runtime visibility, and local startup hardening for the dashboard via a self-contained production image, maintenance fallback page, staged start-dev orchestration, and offline-safe typography. Remaining blockers before Stage 3 review: 5min/15min bucket completeness checks and operator-facing manual correction submission UI.",
  "required_artifacts": [
    "docs/operations/briefings/strategy1Live_briefing.md",
    "docs/references/strategy-notes/strategy1_live_current.pine",
    "agents/artifacts/strategy_specs/strategy1_spec_v1.2.0.md",
    "agents/artifacts/mapping_docs/strategy1_mapping_v1.2.0.md"
  ],
  "human_gates": {
    "founder_spec_logic_resolved": true,
    "senior_backend_pr_approved": false,
    "founder_live_approved": false,
    "devops_deploy_executed": false
  },
  "updated_at_utc": "2026-03-27T11:05:07Z"
}
